[
  {
    "record_id": "10s-positive_trigger",
    "participant_id": "synthetic-10s",
    "method_id": "R01",
    "method_version": "1.1.0",
    "question_id": "synthetic-contract-0",
    "dataset_id": "synthetic-contract-only",
    "origin": "synthetic",
    "phase": "blind",
    "compact_version": "10s",
    "case_type": "positive_trigger",
    "applicable": true,
    "triggered": true,
    "action_success": true,
    "evidence_success": true,
    "stop_required": false,
    "stopped": false,
    "boundary_detected": false,
    "observed_first_action": "synthetic 程序分支记录",
    "observed_evidence": "synthetic 程序分支记录",
    "stop_rule_observation": "synthetic 程序分支记录",
    "participant_restatement": "synthetic，不是学生原话",
    "notes": "程序契约测试，不是真题、参与者或实效结果",
    "resolved": true,
    "standalone": true,
    "assisted": false,
    "role_overclaim": false,
    "answer_backfit": false,
    "execution_breakdown": false,
    "recall_success": true,
    "natural_restatement": true,
    "baseline": {
      "accuracy": true,
      "time_seconds": 20,
      "candidates_remaining": 2,
      "evidence_span": 3,
      "hesitation_count": 1,
      "unresolved": false
    },
    "method": {
      "accuracy": true,
      "time_seconds": 20,
      "candidates_remaining": 2,
      "evidence_span": 3,
      "hesitation_count": 1,
      "unresolved": false
    },
    "communication_freeze_id": "synthetic-not-study",
    "assignment": "uncontrolled",
    "evaluator_id": "synthetic-fixture",
    "declared_primary_role": "decider",
    "observed_actual_role": "decider"
  },
  {
    "record_id": "10s-negative_trigger",
    "participant_id": "synthetic-10s",
    "method_id": "R01",
    "method_version": "1.1.0",
    "question_id": "synthetic-contract-1",
    "dataset_id": "synthetic-contract-only",
    "origin": "synthetic",
    "phase": "blind",
    "compact_version": "10s",
    "case_type": "negative_trigger",
    "applicable": false,
    "triggered": false,
    "action_success": true,
    "evidence_success": true,
    "stop_required": false,
    "stopped": false,
    "boundary_detected": false,
    "observed_first_action": "synthetic 程序分支记录",
    "observed_evidence": "synthetic 程序分支记录",
    "stop_rule_observation": "synthetic 程序分支记录",
    "participant_restatement": "synthetic，不是学生原话",
    "notes": "程序契约测试，不是真题、参与者或实效结果",
    "resolved": false,
    "standalone": false,
    "assisted": false,
    "role_overclaim": false,
    "answer_backfit": false,
    "execution_breakdown": false,
    "recall_success": true,
    "natural_restatement": true,
    "baseline": {
      "accuracy": true,
      "time_seconds": 20,
      "candidates_remaining": 2,
      "evidence_span": 3,
      "hesitation_count": 1,
      "unresolved": false
    },
    "method": {
      "accuracy": true,
      "time_seconds": 20,
      "candidates_remaining": 2,
      "evidence_span": 3,
      "hesitation_count": 1,
      "unresolved": false
    },
    "communication_freeze_id": "synthetic-not-study",
    "assignment": "uncontrolled",
    "evaluator_id": "synthetic-fixture",
    "declared_primary_role": "decider",
    "observed_actual_role": "decider"
  },
  {
    "record_id": "10s-counterexample",
    "participant_id": "synthetic-10s",
    "method_id": "R01",
    "method_version": "1.1.0",
    "question_id": "synthetic-contract-2",
    "dataset_id": "synthetic-contract-only",
    "origin": "synthetic",
    "phase": "blind",
    "compact_version": "10s",
    "case_type": "counterexample",
    "applicable": false,
    "triggered": false,
    "action_success": true,
    "evidence_success": true,
    "stop_required": true,
    "stopped": true,
    "boundary_detected": true,
    "observed_first_action": "synthetic 程序分支记录",
    "observed_evidence": "synthetic 程序分支记录",
    "stop_rule_observation": "synthetic 程序分支记录",
    "participant_restatement": "synthetic，不是学生原话",
    "notes": "程序契约测试，不是真题、参与者或实效结果",
    "resolved": false,
    "standalone": false,
    "assisted": false,
    "role_overclaim": false,
    "answer_backfit": false,
    "execution_breakdown": false,
    "recall_success": true,
    "natural_restatement": true,
    "baseline": {
      "accuracy": true,
      "time_seconds": 20,
      "candidates_remaining": 2,
      "evidence_span": 3,
      "hesitation_count": 1,
      "unresolved": false
    },
    "method": {
      "accuracy": true,
      "time_seconds": 20,
      "candidates_remaining": 2,
      "evidence_span": 3,
      "hesitation_count": 1,
      "unresolved": false
    },
    "communication_freeze_id": "synthetic-not-study",
    "assignment": "uncontrolled",
    "evaluator_id": "synthetic-fixture",
    "declared_primary_role": "decider",
    "observed_actual_role": "decider"
  },
  {
    "record_id": "10s-boundary",
    "participant_id": "synthetic-10s",
    "method_id": "R01",
    "method_version": "1.1.0",
    "question_id": "synthetic-contract-3",
    "dataset_id": "synthetic-contract-only",
    "origin": "synthetic",
    "phase": "blind",
    "compact_version": "10s",
    "case_type": "boundary",
    "applicable": false,
    "triggered": false,
    "action_success": true,
    "evidence_success": true,
    "stop_required": true,
    "stopped": true,
    "boundary_detected": true,
    "observed_first_action": "synthetic 程序分支记录",
    "observed_evidence": "synthetic 程序分支记录",
    "stop_rule_observation": "synthetic 程序分支记录",
    "participant_restatement": "synthetic，不是学生原话",
    "notes": "程序契约测试，不是真题、参与者或实效结果",
    "resolved": false,
    "standalone": false,
    "assisted": false,
    "role_overclaim": false,
    "answer_backfit": false,
    "execution_breakdown": false,
    "recall_success": true,
    "natural_restatement": true,
    "baseline": {
      "accuracy": true,
      "time_seconds": 20,
      "candidates_remaining": 2,
      "evidence_span": 3,
      "hesitation_count": 1,
      "unresolved": false
    },
    "method": {
      "accuracy": true,
      "time_seconds": 20,
      "candidates_remaining": 2,
      "evidence_span": 3,
      "hesitation_count": 1,
      "unresolved": false
    },
    "communication_freeze_id": "synthetic-not-study",
    "assignment": "uncontrolled",
    "evaluator_id": "synthetic-fixture",
    "declared_primary_role": "decider",
    "observed_actual_role": "decider"
  },
  {
    "record_id": "10s-transfer",
    "participant_id": "synthetic-10s",
    "method_id": "R01",
    "method_version": "1.1.0",
    "question_id": "synthetic-contract-4",
    "dataset_id": "synthetic-contract-only",
    "origin": "synthetic",
    "phase": "blind",
    "compact_version": "10s",
    "case_type": "transfer",
    "applicable": true,
    "triggered": true,
    "action_success": true,
    "evidence_success": true,
    "stop_required": false,
    "stopped": false,
    "boundary_detected": false,
    "observed_first_action": "synthetic 程序分支记录",
    "observed_evidence": "synthetic 程序分支记录",
    "stop_rule_observation": "synthetic 程序分支记录",
    "participant_restatement": "synthetic，不是学生原话",
    "notes": "程序契约测试，不是真题、参与者或实效结果",
    "resolved": true,
    "standalone": true,
    "assisted": false,
    "role_overclaim": false,
    "answer_backfit": false,
    "execution_breakdown": false,
    "recall_success": true,
    "natural_restatement": true,
    "baseline": {
      "accuracy": true,
      "time_seconds": 20,
      "candidates_remaining": 2,
      "evidence_span": 3,
      "hesitation_count": 1,
      "unresolved": false
    },
    "method": {
      "accuracy": true,
      "time_seconds": 20,
      "candidates_remaining": 2,
      "evidence_span": 3,
      "hesitation_count": 1,
      "unresolved": false
    },
    "communication_freeze_id": "synthetic-not-study",
    "assignment": "uncontrolled",
    "evaluator_id": "synthetic-fixture",
    "declared_primary_role": "decider",
    "observed_actual_role": "decider"
  },
  {
    "record_id": "30s-positive_trigger",
    "participant_id": "synthetic-30s",
    "method_id": "R01",
    "method_version": "1.1.0",
    "question_id": "synthetic-contract-0",
    "dataset_id": "synthetic-contract-only",
    "origin": "synthetic",
    "phase": "blind",
    "compact_version": "30s",
    "case_type": "positive_trigger",
    "applicable": true,
    "triggered": true,
    "action_success": true,
    "evidence_success": true,
    "stop_required": false,
    "stopped": false,
    "boundary_detected": false,
    "observed_first_action": "synthetic 程序分支记录",
    "observed_evidence": "synthetic 程序分支记录",
    "stop_rule_observation": "synthetic 程序分支记录",
    "participant_restatement": "synthetic，不是学生原话",
    "notes": "程序契约测试，不是真题、参与者或实效结果",
    "resolved": true,
    "standalone": true,
    "assisted": false,
    "role_overclaim": false,
    "answer_backfit": false,
    "execution_breakdown": false,
    "recall_success": true,
    "natural_restatement": true,
    "baseline": {
      "accuracy": true,
      "time_seconds": 20,
      "candidates_remaining": 2,
      "evidence_span": 3,
      "hesitation_count": 1,
      "unresolved": false
    },
    "method": {
      "accuracy": true,
      "time_seconds": 20,
      "candidates_remaining": 2,
      "evidence_span": 3,
      "hesitation_count": 1,
      "unresolved": false
    },
    "communication_freeze_id": "synthetic-not-study",
    "assignment": "uncontrolled",
    "evaluator_id": "synthetic-fixture",
    "declared_primary_role": "decider",
    "observed_actual_role": "decider"
  },
  {
    "record_id": "30s-negative_trigger",
    "participant_id": "synthetic-30s",
    "method_id": "R01",
    "method_version": "1.1.0",
    "question_id": "synthetic-contract-1",
    "dataset_id": "synthetic-contract-only",
    "origin": "synthetic",
    "phase": "blind",
    "compact_version": "30s",
    "case_type": "negative_trigger",
    "applicable": false,
    "triggered": false,
    "action_success": true,
    "evidence_success": true,
    "stop_required": false,
    "stopped": false,
    "boundary_detected": false,
    "observed_first_action": "synthetic 程序分支记录",